{
  "presentation_name": "Test Section Header Builder - Section Modérée",
  "subject": "unit-tests",
  "audience": "section_header_builder_tester",
  "title_slide": {
    "title": "Test Section Header Builder - Section Modérée",
    "subtitle": "Tests unitaires pour l'architecture JSON 2025",
    "metadata": "2025-01-15 - Tests Unitaires"
  },
  "slides": [
    {
      "position": 2,
      "script_name": "section_header_builder",
      "payload_path": "section_header_payload.json",
      "description": "Section header style modéré avec titre technique"
    }
  ],
  "build_options": {
    "auto_widen_text": true,
    "generate_reports": true
  }
}