{
  "presentation_name": "Test Statistics Grey Line",
  "subject": "unit-tests",
  "audience": "statistics_builder_tester",
  "title_slide": {
    "title": "Test Presentation Statistics Builder",
    "subtitle": "2 Statistiques avec Ligne Grise",
    "metadata": "2025-01-15 â€“ Tests Unitaires"
  },
  "slides": [
    {
      "position": 2,
      "script_name": "statistics_builder",
      "payload_path": "test/unit_tests/statistics_builder/stats_2_grey/statistics_payload.json",
      "description": "Test 2 statistiques style grey_line"
    }
  ],
  "build_options": {
    "auto_widen_text": true,
    "generate_reports": true
  }
}