{
  "presentation_name": "Test Simple Message Builder - Message Centré",
  "subject": "unit-tests",
  "audience": "simple_message_builder_tester",
  "title_slide": {
    "title": "Test Simple Message Builder - Message Centré",
    "subtitle": "Tests unitaires pour l'architecture JSON 2025",
    "metadata": "2025-01-15 - Tests Unitaires"
  },
  "slides": [
    {
      "position": 2,
      "script_name": "simple_message_builder",
      "payload_path": "simple_message_payload.json",
      "description": "Message simple centré pour communication directe"
    }
  ],
  "build_options": {
    "auto_widen_text": true,
    "generate_reports": true
  }
}