{
  "presentation_name": "Test Navigation Builder - TOC Détaillée",
  "subject": "unit-tests",
  "audience": "navigation_builder_tester",
  "title_slide": {
    "title": "Test Navigation Builder - TOC Détaillée",
    "subtitle": "Tests unitaires avec 6 sections (limite max)",
    "metadata": "2025-01-15 - Tests Unitaires"
  },
  "slides": [
    {
      "position": 2,
      "script_name": "navigation_builder",
      "payload_path": "navigation_payload.json",
      "description": "Table des matières détaillée avec 6 sections (test de limite)"
    }
  ],
  "build_options": {
    "auto_widen_text": false,
    "generate_reports": true
  }
}