{
  "presentation_name": "Test Content Boxes 4 Detailed",
  "subject": "unit-tests",
  "audience": "content_boxes_builder_tester",
  "title_slide": {
    "title": "Test Content Boxes 4 Boîtes Détaillées",
    "subtitle": "Architecture JSON 2025",
    "metadata": "Test unitaire - Content Boxes Builder"
  },
  "slides": [
    {
      "position": 2,
      "script_name": "content_boxes_builder",
      "payload_path": "test/unit_tests/content_boxes_builder/content_4_boxes/content_boxes_payload.json",
      "description": "Test 4 boîtes bleues avec sous-titres"
    }
  ],
  "build_options": {
    "auto_widen_text": true,
    "generate_reports": true
  }
}