{
  "presentation_name": "Test Content Boxes Custom",
  "subject": "unit-tests",
  "audience": "content_boxes_builder_tester",
  "title_slide": {
    "title": "Test Content Boxes Personnalisé",
    "subtitle": "Architecture JSON 2025",
    "metadata": "Test unitaire - Content Boxes Builder"
  },
  "slides": [
    {
      "position": 2,
      "script_name": "content_boxes_builder",
      "payload_path": "test/unit_tests/content_boxes_builder/custom_content_boxes/content_boxes_payload.json",
      "description": "Test personnalisé avec style gris détaillé"
    }
  ],
  "build_options": {
    "auto_widen_text": true,
    "generate_reports": true
  }
}