{
  "presentation_name": "Test Dual Detailed Explanation",
  "subject": "unit-tests",
  "audience": "detailed_explanation_builder_tester",
  "title_slide": {
    "title": "Test Comparaison Détaillée",
    "subtitle": "Test unitaire detailed_explanation_builder",
    "metadata": "2025-01-14 – Test Premier Tech"
  },
  "slides": [
    {
      "position": 2,
      "script_name": "detailed_explanation_builder",
      "payload_path": "test/unit_tests/detailed_explanation_builder/dual_detailed_explanation/detailed_explanation_payload.json",
      "description": "Test comparaison détaillée avec deux sections"
    }
  ],
  "build_options": {
    "auto_widen_text": true,
    "generate_reports": true
  }
}