{
  "presentation_name": "Test Client Testimonial",
  "subject": "unit-tests",
  "audience": "testimonial_builder_tester",
  "title_slide": {
    "title": "Test Client Testimonial Builder",
    "subtitle": "Validation Architecture JSON 2025",
    "metadata": "2025-01-15 – Test Unitaire"
  },
  "slides": [
    {
      "position": 2,
      "script_name": "testimonial_builder",
      "payload_path": "test/unit_tests/testimonial_builder/client_testimonial/testimonial_payload.json",
      "description": "Test témoignage client avec attribution complète"
    }
  ],
  "build_options": {
    "auto_widen_text": true,
    "generate_reports": true
  }
}