{
  "presentation_name": "Test Compact Charts",
  "subject": "unit-tests",
  "audience": "charts_builder_tester",
  "title_slide": {
    "title": "Test Présentation - Graphiques Compacts",
    "subtitle": "Test unitaire du charts_builder",
    "metadata": "2025-01-15 - Tests Automatisés"
  },
  "slides": [
    {
      "position": 2,
      "script_name": "charts_builder",
      "payload_path": "test/unit_tests/charts_builder/compact_charts/charts_payload.json",
      "description": "Test graphiques en version compacte"
    }
  ],
  "build_options": {
    "auto_widen_text": false,
    "generate_reports": true
  }
}